{
  "schema_version": "1.0",
  "translation_id": "research.assurance.tests-gates.en",
  "translation_of": "research.assurance.tests-gates",
  "source_path": "corpus/original/2026-08-11-chat-import/tare.tools - testes, gates.txt",
  "source_sha256": "675f7f379f78cae06bbc7236cc8136ab9def43bf7e62b2c652d9a224153f634b",
  "translation_path": "corpus/translations/en/2026-08-11-chat-import/tare.tools - testes, gates.en.md",
  "translation_sha256": "3c65d1ce870910781dd2a4821ef837fdf037d337989ff1baf862fb089907aaf4",
  "translation_size_bytes": 8370,
  "source_language": "pt-BR",
  "target_language": "en",
  "translation_status": "MACHINE_TRANSLATED_UNREVIEWED",
  "translator": "OpenAI GPT-5.6 Sol",
  "translated_at": "2026-08-11",
  "policy": "TRANSLATION_POLICY.md",
  "notes": "Faithful derivative translation. Historical claims were not reconciled or silently corrected."
}
