{
  "schema_version": "1.0",
  "translation_id": "historical.research-program.architecture-routing.en",
  "translation_of": "historical.research-program.architecture-routing",
  "source_path": "corpus/original/2026-08-11-chat-import/Arquitetura Multiagente e Roteamento.txt",
  "source_sha256": "0c203d8ac37a6d8f43d569a8fbff6143daa57e54ebe2d41ca32731ecc932446c",
  "translation_path": "corpus/translations/en/2026-08-11-chat-import/Arquitetura Multiagente e Roteamento.en.md",
  "translation_sha256": "2991153797d7905851b044d469bf260be1160c1f308a9f3951f4667317041a51",
  "translation_size_bytes": 51440,
  "source_language": "pt-BR",
  "target_language": "en",
  "translation_status": "MACHINE_TRANSLATED_UNREVIEWED",
  "translator": "OpenAI GPT-5.6 Sol",
  "translated_at": "2026-08-11",
  "policy": "TRANSLATION_POLICY.md",
  "notes": "Faithful derivative translation. Historical claims were not reconciled or silently corrected."
}
