{
  "schema_version": "1.0",
  "translation_id": "archaeology.implementer-session-2.en",
  "translation_of": "archaeology.implementer-session-2",
  "source_path": "corpus/original/2026-08-11-chat-import/tare.tools - sessão de implementer 2.txt",
  "source_sha256": "7c690d94f25760837bae75f35c1b80178d18fbe6392cb8d363a1d844c2cf577d",
  "translation_path": "corpus/translations/en/2026-08-11-chat-import/tare.tools - sessão de implementer 2.en.md",
  "translation_sha256": "e85a8ad587b9bfcb7a2c9dc204d620250f5d27c49f7c69126247676d4e0b3a93",
  "translation_size_bytes": 13514,
  "source_language": "pt-BR",
  "target_language": "en",
  "translation_status": "MACHINE_TRANSLATED_UNREVIEWED",
  "translator": "OpenAI GPT-5.6 Sol",
  "translated_at": "2026-08-11",
  "policy": "TRANSLATION_POLICY.md",
  "notes": "Faithful derivative translation. Historical claims were not reconciled or silently corrected."
}
